{
  "schema_version": 1,
  "job_id": "autopost-example-001",
  "video_file_id": "drive-file-id",
  "video_file_name": "example.mp4",
  "title": "Example video",
  "caption": "Example caption",
  "hashtags": "#subai #example",
  "target_clone": "clone1",
  "channel_folder": "Kenh_1_PhimTomTat_Clone1",
  "schedule_time": "18:30",
  "created_at": "2026-08-21T00:00:00+00:00",
  "status": "QUEUED",
  "source": "subai-desktop"
}
